{
  "doc_id": "doc_resume_001",
  "title": "个人简历",
  "media_type": "application/pdf",
  "text": "张三，男，手机 13800138000。2020-2024 就职于示例科技有限公司，担任后端工程师。",
  "chunks_hint": [
    {
      "text": "张三，男，手机 13800138000。",
      "page": 1
    }
  ],
  "tables": null,
  "metadata": {
    "filename": "resume.pdf",
    "mime": "application/pdf",
    "sha256": "0123456789abcdef0123456789abcdef0123456789abcdef0123456789abcdef",
    "page_count": 2,
    "created_at": "2026-08-10T00:00:00Z"
  },
  "warnings": []
}
